{
  "name": "linux-perf-repair",
  "owner": "Nikolay Petrov and contributors",
  "source_url": "https://github.com/intel/intel-performance-skills",
  "implementation_url": "https://github.com/intel/intel-performance-skills/tree/main/skills/linux-perf",
  "source": {
    "repository": "https://github.com/intel/intel-performance-skills",
    "ref": "main",
    "path": "skills/linux-perf"
  },
  "catalog": {
    "repository": "https://github.com/napetrov/skills",
    "path": "skills/linux-perf-repair"
  },
  "data_classification": "public",
  "output": {
    "type": "agent-instructions",
    "format": "markdown"
  },
  "deployment_geography": ["global"],
  "tools": ["perf", "compiler", "benchmark runner"],
  "network": {
    "required": false,
    "destinations": []
  },
  "scripts": [],
  "permissions": ["read repository files", "run local build and benchmark commands", "run perf when allowed by host policy"],
  "risks": [
    "agent proposes a fix from weak counter evidence",
    "agent fabricates speedups",
    "agent runs privileged perf commands blindly"
  ],
  "mitigations": [
    "require regime classification and explicit unsupported conclusions",
    "require before and after timing plus correctness checks",
    "require permission explanation and fallback to static artifacts where needed"
  ],
  "ethical_considerations": [
    "do not claim performance repairs without reproducible measurements"
  ],
  "release_evidence": {
    "artifact_manifest": "skills.lock.json",
    "attestation": "github-artifact-attestations",
    "signing_workflow": ".github/workflows/release.yml"
  },
  "signature": {
    "status": "github-attested",
    "identity": "https://github.com/napetrov/skills/.github/workflows/release.yml@refs/tags/*",
    "subjects": ["skills.lock.json", "npm package tarball"]
  },
  "verification_status": "smoke-tested"
}
